{
  "meta": { "name": "walled_compound", "style": "persian", "description": "walled compound: central domed hall + two wings, front pool, palms, a couple of trucks" },
  "site": {
    "width_m": 120, "depth_m": 90,
    "ground": { "surface": "sand" },
    "perimeter_wall": { "height_m": 5, "thickness_m": 1.0, "material": "stone_masonry", "corner_towers": true }
  },
  "buildings": [
    {
      "id": "central",
      "footprint": [48, 40, 72, 66],
      "floors": 2,
      "floor_height_m": 4.5,
      "material": "stone_masonry",
      "roof": { "type": "flat" },
      "columns_spacing_m": 7,
      "windows": { "shape": "pointed_arch", "per_facade": { "south": 4, "north": 4, "east": 2, "west": 2 } },
      "entrance": { "facade": "south", "type": "iwan", "shape": "horseshoe_arch", "width_m": 5 },
      "dome": { "radius_m": 5, "height_m": 6, "shape": "onion" }
    },
    {
      "id": "west_wing",
      "footprint": [16, 44, 40, 62],
      "floors": 2, "floor_height_m": 4.0, "material": "stone_masonry",
      "roof": { "type": "flat" },
      "windows": { "shape": "pointed_arch", "per_facade": { "south": 3, "north": 3 } },
      "entrance": { "facade": "south", "type": "door", "shape": "pointed_arch" }
    },
    {
      "id": "east_wing",
      "footprint": [80, 44, 104, 62],
      "floors": 2, "floor_height_m": 4.0, "material": "stone_masonry",
      "roof": { "type": "flat" },
      "windows": { "shape": "pointed_arch", "per_facade": { "south": 3, "north": 3 } },
      "entrance": { "facade": "south", "type": "door", "shape": "pointed_arch" }
    }
  ],
  "pools": [ { "id": "front_pool", "footprint": [56, 24, 64, 34], "depth_m": 0.4 } ],
  "gardens": [ { "id": "court", "footprint": [20, 68, 100, 84] } ],
  "vegetation": [
    { "kind": "palm", "positions": [[12, 12], [24, 12], [36, 12], [84, 12], [96, 12], [108, 12]] }
  ],
  "vehicles": [
    { "id": "truck_a", "kind": "truck", "center": [16, 78], "heading_deg": 270 },
    { "id": "truck_b", "kind": "truck", "center": [22, 78], "heading_deg": 270 }
  ]
}
